{
  "$schema": "https://cortex.engard.me/schema/0.1/character.schema.json",
  "version": "0.1",
  "id": "bf62d3dc-de68-430c-a0cf-a2a16752c261",
  "dateCreated": "2024-03-25T14:21:43.746Z",
  "dateModified": "2024-03-25T14:21:43.746Z",
  "dateTouched": "2024-03-25T14:21:43.746Z",
  "name": "Sendak Eggers",
  "game": "",
  "pronouns": "he/him",
  "description": "A half-orc druid who would really rather be left alone, please.",
  "traitSets": [
    {
      "name": "Distinctions",
      "description": "Trait set description",
      "nounSingular": "Distinction",
      "nounPlural": "Distinctions",
      "traits": [
        {
          "name": "Half-Orc",
          "value": 8,
          "description": "Trait description",
          "traits": [],
          "sfx": [ "hinder" ],
          "tags": [],
          "custom": {}
        },
        {
          "name": "Druid",
          "value": 10,
          "description": "Trait description",
          "traits": [],
          "sfx": [ "hinder" ],
          "tags": [],
          "custom": {}
        },
        {
          "name": "Sage",
          "value": 8,
          "description": "Trait description",
          "traits": [],
          "sfx": [ "hinder" ],
          "tags": [],
          "custom": {}
        }
      ],
      "sfx": [],
      "tags": [],
      "custom": {
        "cortexToolkit": {
          "features": {
            "description": true,
            "sfx": true,
            "subtraits": false
          },
          "location": "left",
          "style": {
            "header": "distinctions",
            "body": "distinctions"
          }
        }
      }
    },
    {
      "name": "Attributes",
      "description": "Trait set description",
      "nounSingular": "Attribute",
      "nounPlural": "Attributes",
      "traits": [
        {
          "name": "Strength",
          "value": 8,
          "description": "Trait description",
          "traits": [],
          "sfx": [],
          "tags": [],
          "custom": {}
        },
        {
          "name": "Agility",
          "value": 6,
          "description": "Trait description",
          "traits": [],
          "sfx": [],
          "tags": [],
          "custom": {}
        },
        {
          "name": "Wisdom",
          "value": 10,
          "description": "Trait description",
          "traits": [],
          "sfx": [],
          "tags": [],
          "custom": {}
        }
      ],
      "sfx": [],
      "tags": [],
      "custom": {
        "cortexToolkit": {
          "features": {
            "description": false,
            "sfx": false,
            "subtraits": false
          },
          "location": "attributes",
          "style": {
            "header": "attributes",
            "body": "attributes"
          }
        }
      }
    },
    {
      "name": "Values",
      "description": "Trait set description",
      "nounSingular": "Value",
      "nounPlural": "Values",
      "traits": [
        {
          "name": "Honor",
          "value": 6,
          "description": "Trait description",
          "traits": [],
          "sfx": [],
          "tags": [],
          "custom": {}
        },
        {
          "name": "Wealth",
          "value": 4,
          "description": "Trait description",
          "traits": [],
          "sfx": [],
          "tags": [],
          "custom": {}
        },
        {
          "name": "Kindness",
          "value": 8,
          "description": "Trait description",
          "traits": [],
          "sfx": [],
          "tags": [],
          "custom": {}
        },
        {
          "name": "Justice",
          "value": 8,
          "description": "Trait description",
          "traits": [],
          "sfx": [],
          "tags": [],
          "custom": {}
        },
        {
          "name": "Truth",
          "value": 12,
          "description": "Trait description",
          "traits": [],
          "sfx": [],
          "tags": [],
          "custom": {}
        },
        {
          "name": "Power",
          "value": 6,
          "description": "Trait description",
          "traits": [],
          "sfx": [],
          "tags": [],
          "custom": {}
        }
      ],
      "sfx": [],
      "tags": [],
      "custom": {
        "cortexToolkit": {
          "features": {
            "description": false,
            "sfx": false,
            "subtraits": false
          },
          "location": "left",
          "style": {
            "header": "two-columns-compact",
            "body": "two-columns-compact"
          }
        }
      }
    },
    {
      "name": "Stress",
      "description": "Trait set description",
      "nounSingular": "Stress",
      "nounPlural": "Stress",
      "traits": [
        {
          "name": "Harm",
          "value": 10,
          "description": "Trait description",
          "traits": [],
          "sfx": [],
          "tags": [],
          "custom": {}
        },
        {
          "name": "Stress",
          "value": 6,
          "description": "Trait description",
          "traits": [],
          "sfx": [],
          "tags": [],
          "custom": {}
        },
        {
          "name": "Doubt",
          "value": 8,
          "description": "Trait description",
          "traits": [],
          "sfx": [],
          "tags": [],
          "custom": {}
        }
      ],
      "sfx": [],
      "tags": [],
      "custom": {
        "cortexToolkit": {
          "features": {
            "description": false,
            "sfx": false,
            "subtraits": false
          },
          "location": "right",
          "style": {
            "header": "stress",
            "body": "stress"
          }
        }
      }
    },
    {
      "name": "Signature Assets",
      "description": "Trait set description",
      "nounSingular": "Asset",
      "nounPlural": "Assets",
      "traits": [
        {
          "name": "Shillelagh",
          "value": 8,
          "description": "Trait description",
          "traits": [],
          "sfx": [],
          "tags": [],
          "custom": {}
        },
        {
          "name": "New Asset",
          "value": 6,
          "description": "Trait description",
          "traits": [],
          "sfx": [],
          "tags": [],
          "custom": {}
        }
      ],
      "sfx": [],
      "tags": [],
      "custom": {
        "cortexToolkit": {
          "features": {
            "description": true,
            "sfx": false,
            "subtraits": false
          },
          "location": "left",
          "style": {
            "header": "assets",
            "body": "assets"
          }
        }
      }
    },
    {
      "name": "Affiliations",
      "description": "Trait set description",
      "nounSingular": "Affiliation",
      "nounPlural": "Affiliations",
      "traits": [
        {
          "name": "Circle of the Moon",
          "value": 6,
          "description": "Trait description",
          "traits": [],
          "sfx": [],
          "tags": [],
          "custom": {}
        },
        {
          "name": "Kingâ€™s Guard",
          "value": 6,
          "description": "Trait description",
          "traits": [],
          "sfx": [],
          "tags": [],
          "custom": {}
        },
        {
          "name": "Biggetyburgh",
          "value": 6,
          "description": "Trait description",
          "traits": [],
          "sfx": [],
          "tags": [],
          "custom": {}
        }
      ],
      "sfx": [],
      "tags": [],
      "custom": {
        "cortexToolkit": {
          "features": {
            "description": true,
            "sfx": false,
            "subtraits": false
          },
          "location": "left",
          "style": {
            "header": "resources",
            "body": "resources"
          }
        }
      }
    },
    {
      "name": "Skills",
      "description": "Trait set description",
      "nounSingular": "Skill",
      "nounPlural": "Skills",
      "traits": [
        {
          "name": "Athletics",
          "value": 6,
          "description": "Trait description",
          "traits": [
            {
              "name": "Jump",
              "value": 6,
              "description": "",
              "traits": [],
              "sfx": [],
              "tags": [],
              "custom": {}
            },
            {
              "name": "Swim",
              "value": 10,
              "description": "",
              "traits": [],
              "sfx": [],
              "tags": [],
              "custom": {}
            },
            {
              "name": "Climb",
              "value": 8,
              "description": "",
              "traits": [],
              "sfx": [],
              "tags": [],
              "custom": {}
            }
          ],
          "sfx": [],
          "tags": [],
          "custom": {}
        },
        {
          "name": "Knowledge",
          "value": 6,
          "description": "Trait description",
          "traits": [
            {
              "name": "Arcana",
              "value": 6,
              "description": "",
              "traits": [],
              "sfx": [],
              "tags": [],
              "custom": {}
            },
            {
              "name": "Nature",
              "value": 10,
              "description": "",
              "traits": [],
              "sfx": [],
              "tags": [],
              "custom": {}
            },
            {
              "name": "Society",
              "value": 8,
              "description": "",
              "traits": [],
              "sfx": [],
              "tags": [],
              "custom": {}
            }
          ],
          "sfx": [],
          "tags": [],
          "custom": {}
        }
      ],
      "sfx": [],
      "tags": [],
      "custom": {
        "cortexToolkit": {
          "features": {
            "description": false,